{
  "$schema": "http://json-schema.org/draft-07/schema#",
  "title": "JeecgBoot配置Schema(简化版)",
  "description": "验证JSON配置文件核心结构",
  "type": "object",
  "required": ["head", "fields", "indexs", "deleteFieldIds", "deleteIndexIds"],
  "properties": {
    "head": {
      "type": "object",
      "required": ["tableName", "tableTxt", "business_entity", "tableType", "formCategory"],
      "properties": {
        "tableName": {
          "type": "string",
          "pattern": "^[a-z]+_[a-z]+_[a-z]+$"
        },
        "tableTxt": {
          "type": "string",
          "minLength": 1
        },
        "business_entity": {
          "type": "string",
          "pattern": "^[A-Z][a-zA-Z]*$"
        },
        "tableType": {
          "type": "integer",
          "enum": [1, 2, 3],
          "description": "表类型：1=独立表，2=主表，3=子表"
        },
        "relationType": {
          "type": ["integer", "null"],
          "enum": [null, 0, 1],
          "description": "关联类型：null=无关联，0=一对多，1=一对一"
        },
        "tabOrderNum": {
          "type": ["integer", "null"],
          "minimum": 1,
          "description": "子表显示顺序，仅子表使用"
        },
        "formCategory": {
          "type": "string",
          "enum": ["temp"]
        }
      },
      "additionalProperties": true
    },
    "fields": {
      "type": "array",
      "minItems": 8,
      "description": "字段数组，orderNum必须从0开始连续递增",
      "items": {
        "type": "object",
        "required": ["dbFieldName", "dbFieldTxt", "dbType", "orderNum"],
        "properties": {
          "dbFieldName": {
            "type": "string",
            "minLength": 1,
            "maxLength": 32,
            "pattern": "^[a-z][a-z0-9_]*$",
            "description": "字段名，最大32字符，对应数据库表onl_cgform_field.db_field_name字段限制"
          },
          "dbFieldTxt": {
            "type": "string",
            "minLength": 1
          },
          "dbType": {
            "type": "string",
            "enum": ["string", "int", "BigDecimal", "Date", "Datetime", "text"]
          },
          "orderNum": {
            "type": "integer",
            "minimum": 0,
            "description": "必须从0开始严格连续递增"
          },
          "queryMode": {
            "type": "string",
            "maxLength": 10,
            "enum": ["single", "range", "like", "in", "between"],
            "description": "查询模式，最大10字符"
          },
          "fieldShowType": {
            "type": "string",
            "maxLength": 20,
            "description": "显示类型，最大20字符"
          },
          "queryShowType": {
            "type": "string",
            "maxLength": 50,
            "description": "查询显示类型，最大50字符"
          },
          "fieldValidType": {
            "type": "string",
            "maxLength": 300,
            "description": "字段验证类型，最大300字符"
          }
        },
        "additionalProperties": true
      }
    },
    "indexs": {
      "type": "array"
    },
    "deleteFieldIds": {
      "type": "array"
    },
    "deleteIndexIds": {
      "type": "array"
    },
    "metadata": {
      "type": "object",
      "properties": {
        "generation_info": {
          "type": "object",
          "required": ["module_name", "submodule_name", "business_entity"]
        },
        "derived_formats": {
          "type": "object",
          "required": ["table_suffix", "url_path", "frontend_path"]
        }
      }
    },
    "subList": {
      "type": "array",
      "description": "主子表关联场景的子表配置数组（可选）",
      "items": {
        "type": "object",
        "required": ["tableName", "entityName", "ftlDescription", "id"],
        "properties": {
          "tableName": {
            "type": "string",
            "pattern": "^[a-z0-9_]+$",
            "description": "子表的表名，3段式命名结构"
          },
          "entityName": {
            "type": "string",
            "pattern": "^[A-Z][a-zA-Z0-9]*$",
            "minLength": 1,
            "description": "子表的Java实体类名称，必须使用完整复合格式：主表实体名+子表实体名，如StudentInfoParentInfo",
            "examples": ["StudentInfoParentInfo", "CustomerProfileContactInfo"],
            "errorMessage": "entityName必须为完整复合格式，避免JeecgBoot API空指针异常"
          },
          "ftlDescription": {
            "type": "string",
            "minLength": 1,
            "maxLength": 100,
            "description": "子表的业务描述"
          },
          "id": {
            "type": "string",
            "pattern": "^row_[0-9]{4}$",
            "description": "子表ID，格式为row_xxxx，从1020开始递增"
          }
        },
        "additionalProperties": false
      }
    }
  },
  "additionalProperties": true
}
