{
  "head": {
    "tableName": "copyright_apply_copyrightconfig",
    "tableTxt": "软著申请配置表",
    "business_entity": "CopyrightConfig",
    "tableType": 1,
    "relationType": null,
    "tabOrderNum": null,
    "subTableStr": "",
    "formCategory": "temp",
    "idType": "UUID",
    "isCheckbox": "Y",
    "themeTemplate": "normal",
    "formTemplate": "1",
    "scroll": 1,
    "isPage": "Y",
    "isTree": "N",
    "extConfigJson": "{\"reportPrintShow\":0,\"reportPrintUrl\":\"\",\"joinQuery\":0,\"modelFullscreen\":0,\"modalMinWidth\":\"\",\"commentStatus\":0,\"tableFixedAction\":1,\"tableFixedActionType\":\"right\",\"formLabelLengthShow\":0,\"formLabelLength\":null,\"enableExternalLink\":0,\"externalLinkActions\":\"add,edit,detail\"}",
    "isDesForm": "N",
    "desFormCode": ""
  },
  "metadata": {
    "generation_info": {
      "module_name": "copyright",
      "submodule_name": "apply",
      "business_entity": "CopyrightConfig",
      "inference_strategy": "user_provided",
      "semantic_analysis": "软著申请配置表管理系统"
    },
    "derived_formats": {
      "table_suffix": "copyrightconfig",
      "url_path": "/copyright/apply/copyrightconfig",
      "frontend_path": "views/copyright/apply"
    }
  },
  "fields": [
    {
      "dbFieldName": "id",
      "dbFieldTxt": "主键",
      "queryShowType": "text",
      "queryDictTable": "",
      "queryDictField": "",
      "queryDictText": "",
      "queryDefVal": "",
      "queryConfigFlag": "0",
      "mainTable": "",
      "mainField": "",
      "fieldHref": "",
      "fieldValidType": "",
      "fieldMustInput": "0",
      "dictTable": "",
      "dictField": "",
      "dictText": "",
      "isShowForm": "0",
      "isShowList": "0",
      "sortFlag": "0",
      "isReadOnly": "1",
      "fieldShowType": "text",
      "fieldLength": 200,
      "isQuery": "0",
      "queryMode": "single",
      "fieldDefaultValue": "",
      "converter": "",
      "fieldExtendJson": "",
      "fieldConfig": "",
      "dbLength": 36,
      "dbPointLength": 0,
      "dbDefaultVal": "",
      "dbType": "string",
      "dbIsKey": "1",
      "dbIsNull": "0",
      "dbIsPersist": "1",
      "orderNum": 0
    },
    {
      "dbFieldName": "create_by",
      "dbFieldTxt": "创建人",
      "queryShowType": "text",
      "queryDictTable": "",
      "queryDictField": "",
      "queryDictText": "",
      "queryDefVal": "",
      "queryConfigFlag": "0",
      "mainTable": "",
      "mainField": "",
      "fieldHref": "",
      "fieldValidType": "",
      "fieldMustInput": "1",
      "dictTable": "",
      "dictField": "",
      "dictText": "",
      "isShowForm": "0",
      "isShowList": "0",
      "sortFlag": "0",
      "isReadOnly": "0",
      "fieldShowType": "text",
      "fieldLength": 200,
      "isQuery": "0",
      "queryMode": "single",
      "fieldDefaultValue": "",
      "converter": "",
      "fieldExtendJson": "",
      "fieldConfig": "",
      "dbLength": 50,
      "dbPointLength": 0,
      "dbDefaultVal": "",
      "dbType": "string",
      "dbIsKey": "0",
      "dbIsNull": "0",
      "dbIsPersist": "1",
      "orderNum": 1
    },
    {
      "dbFieldName": "create_time",
      "dbFieldTxt": "创建日期",
      "queryShowType": "text",
      "queryDictTable": "",
      "queryDictField": "",
      "queryDictText": "",
      "queryDefVal": "",
      "queryConfigFlag": "0",
      "mainTable": "",
      "mainField": "",
      "fieldHref": "",
      "fieldValidType": "",
      "fieldMustInput": "1",
      "dictTable": "",
      "dictField": "",
      "dictText": "",
      "isShowForm": "0",
      "isShowList": "0",
      "sortFlag": "0",
      "isReadOnly": "0",
      "fieldShowType": "datetime",
      "fieldLength": 200,
      "isQuery": "0",
      "queryMode": "single",
      "fieldDefaultValue": "",
      "converter": "",
      "fieldExtendJson": "",
      "fieldConfig": "",
      "dbLength": 0,
      "dbPointLength": 0,
      "dbDefaultVal": "",
      "dbType": "Datetime",
      "dbIsKey": "0",
      "dbIsNull": "0",
      "dbIsPersist": "1",
      "orderNum": 2
    },
    {
      "dbFieldName": "update_by",
      "dbFieldTxt": "更新人",
      "queryShowType": "text",
      "queryDictTable": "",
      "queryDictField": "",
      "queryDictText": "",
      "queryDefVal": "",
      "queryConfigFlag": "0",
      "mainTable": "",
      "mainField": "",
      "fieldHref": "",
      "fieldValidType": "",
      "fieldMustInput": "0",
      "dictTable": "",
      "dictField": "",
      "dictText": "",
      "isShowForm": "0",
      "isShowList": "0",
      "sortFlag": "0",
      "isReadOnly": "1",
      "fieldShowType": "text",
      "fieldLength": 200,
      "isQuery": "0",
      "queryMode": "single",
      "fieldDefaultValue": "",
      "converter": "",
      "fieldExtendJson": "",
      "fieldConfig": "",
      "dbLength": 50,
      "dbPointLength": 0,
      "dbDefaultVal": "",
      "dbType": "string",
      "dbIsKey": "0",
      "dbIsNull": "1",
      "dbIsPersist": "1",
      "orderNum": 3
    },
    {
      "dbFieldName": "update_time",
      "dbFieldTxt": "更新时间",
      "queryShowType": "date",
      "queryDictTable": "",
      "queryDictField": "",
      "queryDictText": "",
      "queryDefVal": "",
      "queryConfigFlag": "0",
      "mainTable": "",
      "mainField": "",
      "fieldHref": "",
      "fieldValidType": "",
      "fieldMustInput": "0",
      "dictTable": "",
      "dictField": "",
      "dictText": "",
      "isShowForm": "0",
      "isShowList": "1",
      "sortFlag": "0",
      "isReadOnly": "1",
      "fieldShowType": "datetime",
      "fieldLength": 200,
      "isQuery": "0",
      "queryMode": "single",
      "fieldDefaultValue": "",
      "converter": "",
      "fieldExtendJson": "",
      "fieldConfig": "",
      "dbLength": 0,
      "dbPointLength": 0,
      "dbDefaultVal": "",
      "dbType": "Datetime",
      "dbIsKey": "0",
      "dbIsNull": "1",
      "dbIsPersist": "1",
      "orderNum": 4
    },
    {
      "dbFieldName": "sys_org_code",
      "dbFieldTxt": "所属部门",
      "queryShowType": "text",
      "queryDictTable": "",
      "queryDictField": "",
      "queryDictText": "",
      "queryDefVal": "",
      "queryConfigFlag": "0",
      "mainTable": "",
      "mainField": "",
      "fieldHref": "",
      "fieldValidType": "",
      "fieldMustInput": "1",
      "dictTable": "",
      "dictField": "",
      "dictText": "",
      "isShowForm": "0",
      "isShowList": "0",
      "sortFlag": "0",
      "isReadOnly": "0",
      "fieldShowType": "text",
      "fieldLength": 200,
      "isQuery": "0",
      "queryMode": "single",
      "fieldDefaultValue": "",
      "converter": "",
      "fieldExtendJson": "",
      "fieldConfig": "",
      "dbLength": 64,
      "dbPointLength": 0,
      "dbDefaultVal": "",
      "dbType": "string",
      "dbIsKey": "0",
      "dbIsNull": "0",
      "dbIsPersist": "1",
      "orderNum": 5
    },
    {
      "dbFieldName": "del_flag",
      "dbFieldTxt": "删除标志",
      "queryShowType": "text",
      "queryDictTable": "",
      "queryDictField": "",
      "queryDictText": "",
      "queryDefVal": "",
      "queryConfigFlag": "0",
      "mainTable": "",
      "mainField": "",
      "fieldHref": "",
      "fieldValidType": "",
      "fieldMustInput": "1",
      "dictTable": "",
      "dictField": "",
      "dictText": "",
      "isShowForm": "0",
      "isShowList": "0",
      "sortFlag": "0",
      "isReadOnly": "0",
      "fieldShowType": "text",
      "fieldLength": 120,
      "isQuery": "0",
      "queryMode": "single",
      "fieldDefaultValue": "0",
      "converter": "",
      "fieldExtendJson": "",
      "fieldConfig": "",
      "dbLength": 1,
      "dbPointLength": 0,
      "dbDefaultVal": "0",
      "dbType": "int",
      "dbIsKey": "0",
      "dbIsNull": "0",
      "dbIsPersist": "1",
      "orderNum": 6
    },
    {
      "dbFieldName": "config_key",
      "dbFieldTxt": "配置键",
      "queryShowType": "text",
      "queryDictTable": "",
      "queryDictField": "",
      "queryDictText": "",
      "queryDefVal": "",
      "queryConfigFlag": "1",
      "mainTable": "",
      "mainField": "",
      "fieldHref": "",
      "fieldValidType": "",
      "fieldMustInput": "1",
      "dictTable": "",
      "dictField": "",
      "dictText": "",
      "isShowForm": "1",
      "isShowList": "1",
      "sortFlag": "0",
      "isReadOnly": "0",
      "fieldShowType": "text",
      "fieldLength": 120,
      "isQuery": "1",
      "queryMode": "single",
      "fieldDefaultValue": "",
      "converter": "",
      "fieldExtendJson": "",
      "fieldConfig": "",
      "dbLength": 100,
      "dbPointLength": 0,
      "dbDefaultVal": "",
      "dbType": "string",
      "dbIsKey": "0",
      "dbIsNull": "0",
      "dbIsPersist": "1",
      "orderNum": 7
    },
    {
      "dbFieldName": "config_value",
      "dbFieldTxt": "配置值",
      "queryShowType": "text",
      "queryDictTable": "",
      "queryDictField": "",
      "queryDictText": "",
      "queryDefVal": "",
      "queryConfigFlag": "0",
      "mainTable": "",
      "mainField": "",
      "fieldHref": "",
      "fieldValidType": "",
      "fieldMustInput": "1",
      "dictTable": "",
      "dictField": "",
      "dictText": "",
      "isShowForm": "1",
      "isShowList": "0",
      "sortFlag": "0",
      "isReadOnly": "0",
      "fieldShowType": "textarea",
      "fieldLength": 500,
      "isQuery": "0",
      "queryMode": "single",
      "fieldDefaultValue": "",
      "converter": "",
      "fieldExtendJson": "",
      "fieldConfig": "",
      "dbLength": 0,
      "dbPointLength": 0,
      "dbDefaultVal": "",
      "dbType": "text",
      "dbIsKey": "0",
      "dbIsNull": "0",
      "dbIsPersist": "1",
      "orderNum": 8
    },
    {
      "dbFieldName": "config_type",
      "dbFieldTxt": "配置类型",
      "queryShowType": "text",
      "queryDictTable": "",
      "queryDictField": "",
      "queryDictText": "",
      "queryDefVal": "",
      "queryConfigFlag": "1",
      "mainTable": "",